{
  "release_package_plan_id": "rpp_door_left_lit_album",
  "project_id": "proj_door_left_lit",
  "source_id": "src_door_left_lit",
  "artist_meaning_id": "meaning_door_left_lit",
  "transformation_brief_id": "tb_door_left_lit",
  "album_beat_plan_id": "bp_door_left_lit_album",
  "package_subtype": "album",
  "primary_medium": "sound",
  "album_cohesion_mode": "arc_album",
  "long_work_stewardship_record_ids": [
    "lws_door_left_lit_album"
  ],
  "working_release_copy": {
    "working_title": "Door Left Lit",
    "working_description": "A sound-first album about standing close to release without forcing the crossing.",
    "polished_text_deliverables_required": false,
    "status": "artist_approved_for_planning"
  },
  "tracks": [
    {
      "track_id": "track_door_01",
      "track_number": 1,
      "working_track_title": "Key In Hand",
      "album_beat_ref": {
        "beat_id": "beat_album_approach",
        "key_emotional_movement_id": "kem_album_threshold",
        "long_work_part_id": "lwpart_album_01"
      },
      "track_level_beat_plan_id": null,
      "sound_medium_plan_id": "smp_door_left_lit_calibration",
      "sound_prompt_plan_id": null,
      "track_cover_deliverable_id": "deliv_track_01_cover",
      "lyrics_policy": "lyrics_optional",
      "status": "ready_for_calibration"
    },
    {
      "track_id": "track_door_02",
      "track_number": 2,
      "working_track_title": "Light That Refuses",
      "album_beat_ref": {
        "beat_id": "beat_album_threshold",
        "key_emotional_movement_id": "kem_album_threshold",
        "long_work_part_id": "lwpart_album_02"
      },
      "track_level_beat_plan_id": null,
      "sound_medium_plan_id": null,
      "sound_prompt_plan_id": null,
      "track_cover_deliverable_id": "deliv_track_02_cover",
      "lyrics_policy": "instrumental",
      "status": "planned"
    },
    {
      "track_id": "track_door_03",
      "track_number": 3,
      "working_track_title": "No Crossing",
      "album_beat_ref": {
        "beat_id": "beat_album_residue",
        "key_emotional_movement_id": "kem_album_residue",
        "long_work_part_id": "lwpart_album_03"
      },
      "track_level_beat_plan_id": null,
      "sound_medium_plan_id": null,
      "sound_prompt_plan_id": null,
      "track_cover_deliverable_id": "deliv_track_03_cover",
      "lyrics_policy": "lyrics_optional",
      "status": "planned"
    }
  ],
  "deliverables": [
    {
      "deliverable_id": "deliv_album_title",
      "deliverable_type": "album_title",
      "required": true,
      "track_id": null,
      "medium_role": "supporting",
      "medium_plan_id": null,
      "prompt_plan_id": null,
      "text_generation_plan_id": null,
      "output_record_id": null,
      "review_record_id": null,
      "status": "planned"
    },
    {
      "deliverable_id": "deliv_album_description",
      "deliverable_type": "album_description",
      "required": true,
      "track_id": null,
      "medium_role": "supporting",
      "medium_plan_id": null,
      "prompt_plan_id": null,
      "text_generation_plan_id": null,
      "output_record_id": null,
      "review_record_id": null,
      "status": "planned"
    },
    {
      "deliverable_id": "deliv_album_cover",
      "deliverable_type": "album_cover",
      "required": true,
      "track_id": null,
      "medium_role": "supporting",
      "medium_plan_id": null,
      "prompt_plan_id": null,
      "text_generation_plan_id": null,
      "output_record_id": null,
      "review_record_id": null,
      "status": "planned"
    },
    {
      "deliverable_id": "deliv_track_01_sound",
      "deliverable_type": "track_sound_prompt_plan",
      "required": true,
      "track_id": "track_door_01",
      "medium_role": "primary",
      "medium_plan_id": "smp_door_left_lit_calibration",
      "prompt_plan_id": null,
      "text_generation_plan_id": null,
      "output_record_id": null,
      "review_record_id": null,
      "status": "ready_for_calibration"
    },
    {
      "deliverable_id": "deliv_track_01_cover",
      "deliverable_type": "track_cover_image_prompt_plan",
      "required": true,
      "track_id": "track_door_01",
      "medium_role": "supporting",
      "medium_plan_id": "imp_door_left_lit_calibration_cover",
      "prompt_plan_id": null,
      "text_generation_plan_id": null,
      "output_record_id": null,
      "review_record_id": null,
      "status": "ready_for_calibration"
    },
    {
      "deliverable_id": "deliv_track_02_sound",
      "deliverable_type": "track_sound_prompt_plan",
      "required": true,
      "track_id": "track_door_02",
      "medium_role": "primary",
      "medium_plan_id": null,
      "prompt_plan_id": null,
      "text_generation_plan_id": null,
      "output_record_id": null,
      "review_record_id": null,
      "status": "planned"
    },
    {
      "deliverable_id": "deliv_track_02_cover",
      "deliverable_type": "track_cover_image_prompt_plan",
      "required": true,
      "track_id": "track_door_02",
      "medium_role": "supporting",
      "medium_plan_id": null,
      "prompt_plan_id": null,
      "text_generation_plan_id": null,
      "output_record_id": null,
      "review_record_id": null,
      "status": "planned"
    },
    {
      "deliverable_id": "deliv_track_03_sound",
      "deliverable_type": "track_sound_prompt_plan",
      "required": true,
      "track_id": "track_door_03",
      "medium_role": "primary",
      "medium_plan_id": null,
      "prompt_plan_id": null,
      "text_generation_plan_id": null,
      "output_record_id": null,
      "review_record_id": null,
      "status": "planned"
    },
    {
      "deliverable_id": "deliv_track_03_cover",
      "deliverable_type": "track_cover_image_prompt_plan",
      "required": true,
      "track_id": "track_door_03",
      "medium_role": "supporting",
      "medium_plan_id": null,
      "prompt_plan_id": null,
      "text_generation_plan_id": null,
      "output_record_id": null,
      "review_record_id": null,
      "status": "planned"
    }
  ],
  "album_sonic_system": {
    "status": "artist_approved_for_calibration",
    "shared_sonic_language": "Suspended builds, restrained low pulses, and unresolved harmonic openings carry the album's threshold pressure.",
    "allowed_variation": [
      "Each track may change density and vocal presence as long as release remains withheld.",
      "The final track may thin out instead of climaxing."
    ],
    "recurring_motifs": [
      "a key-like metallic attack",
      "doorway reverb that opens but never resolves"
    ],
    "voice_and_instrumentation": [
      "close, restrained vocal fragments when lyrics are used",
      "muted piano, low synth, brushed percussion"
    ],
    "production_constraints": [
      "avoid triumphant drops",
      "avoid bright major-key release"
    ],
    "consistency_rules": [
      "Every track should keep one sound element suspended past its expected resolution."
    ]
  },
  "album_visual_system": {
    "status": "artist_approved_for_calibration",
    "shared_visual_language": "Doorway light, hand-scale objects, and negative space make each cover feel close to action but not released.",
    "allowed_variation": [
      "Track Covers may change object focus and distance from the threshold.",
      "The album cover may be more iconic than the Track Covers."
    ],
    "recurring_symbols": [
      "key",
      "lit threshold",
      "uncrossed boundary"
    ],
    "style_constraints": [
      "restrained cinematic realism",
      "low contrast around the figure with precise light at the threshold"
    ],
    "consistency_rules": [
      "No cover should show the figure fully crossing the doorway."
    ]
  },
  "album_calibration": {
    "status": "medium_plans_ready",
    "calibration_track_id": "track_door_01",
    "calibration_visual_target_deliverable_id": "deliv_track_01_cover",
    "representative_medium_plan_refs": [
      {
        "ref_type": "sound_medium_plan",
        "ref_id": "smp_door_left_lit_calibration",
        "path_or_ref": "tests/fixtures/release-packages/album-calibration/sound-medium-plan.json"
      },
      {
        "ref_type": "image_medium_plan",
        "ref_id": "imp_door_left_lit_calibration_cover",
        "path_or_ref": "tests/fixtures/release-packages/album-calibration/image-medium-plan.json"
      }
    ],
    "subchecks": [
      {
        "subcheck_type": "sonic_direction",
        "status": "pending",
        "required_for_deliverable_types": [
          "track_sound_prompt_plan"
        ],
        "gate_decision_id": null,
        "review_note": "Confirm the calibration track carries threshold pressure before expanding remaining track prompts."
      },
      {
        "subcheck_type": "visual_direction",
        "status": "pending",
        "required_for_deliverable_types": [
          "album_cover",
          "track_cover_image_prompt_plan"
        ],
        "gate_decision_id": null,
        "review_note": "Confirm the calibration Track Cover can express the shared Album Visual System."
      },
      {
        "subcheck_type": "sound_visual_fit",
        "status": "pending",
        "required_for_deliverable_types": [
          "track_cover_image_prompt_plan"
        ],
        "gate_decision_id": null,
        "review_note": "Confirm the track sound and Track Cover feel like one release direction."
      }
    ]
  },
  "production_order": [
    {
      "order_index": 1,
      "step_type": "album_artist_meaning",
      "status": "complete",
      "required_before_step_types": [
        "album_cohesion_mode"
      ]
    },
    {
      "order_index": 2,
      "step_type": "album_cohesion_mode",
      "status": "complete",
      "required_before_step_types": [
        "album_beat_plan"
      ]
    },
    {
      "order_index": 3,
      "step_type": "album_beat_plan",
      "status": "complete",
      "required_before_step_types": [
        "long_work_stewardship_creation"
      ]
    },
    {